Date,Task,Hour,Project,Type
2019-05-03,ERD Diagram Design,12,Appsero,New Feature
2019-05-08,Muck up Design,15,Appsero,New Feature
2019-05-10,Design UI of team,12,Appsero,New Feature
2019-05-16,"Show Team list and create, update team",24,Appsero,New Feature
2019-05-20,List permission and assign these to role,12,Appsero,New Feature
2019-05-22,Hide Frontend menu and other links based on role,10,Appsero,New Feature
2019-05-28,Team Switch Option,24,Appsero,New Feature
2019-05-31,Filter Plugin and Theme based on current team,12,Appsero,New Feature